{
  "$schema": "./golden-hashes.schema.json",
  "version": "1.0",
  "mcp_name": "Irish Law MCP",
  "jurisdiction": "IE",
  "description": "Drift detection anchors for stable Irish statutory sources.",
  "provisions": [
    {
      "id": "ie-hash-001",
      "description": "Adaptation of Enactments Act 1922 (Act No. 2) foundational adaptation text",
      "upstream_url": "https://www.irishstatutebook.ie/eli/1922/act/2/enacted/en/html",
      "selector_hint": "Section 1",
      "expected_sha256": "COMPUTE_ON_FIRST_RUN",
      "expected_snippet": "Central Fund of Saorstat Eireann"
    },
    {
      "id": "ie-hash-002",
      "description": "Data Protection Act 2018 core definitional and scope provisions",
      "upstream_url": "https://www.irishstatutebook.ie/eli/2018/act/7/enacted/en/html",
      "selector_hint": "Part 1",
      "expected_sha256": "COMPUTE_ON_FIRST_RUN",
      "expected_snippet": "Data Protection Act 2018"
    },
    {
      "id": "ie-hash-003",
      "description": "Criminal Justice (Theft and Fraud Offences) Act 2001",
      "upstream_url": "https://www.irishstatutebook.ie/eli/2001/act/50/enacted/en/html",
      "selector_hint": "Section 1",
      "expected_sha256": "COMPUTE_ON_FIRST_RUN",
      "expected_snippet": "theft and fraud"
    },
    {
      "id": "ie-hash-004",
      "description": "Employment Equality Act 1998",
      "upstream_url": "https://www.irishstatutebook.ie/eli/1998/act/21/enacted/en/html",
      "selector_hint": "Part 1",
      "expected_sha256": "COMPUTE_ON_FIRST_RUN",
      "expected_snippet": "equality"
    },
    {
      "id": "ie-hash-005",
      "description": "Interpretation Act 2005",
      "upstream_url": "https://www.irishstatutebook.ie/eli/2005/act/23/enacted/en/html",
      "selector_hint": "Section 1",
      "expected_sha256": "COMPUTE_ON_FIRST_RUN",
      "expected_snippet": "interpretation"
    }
  ]
}
